{
  "protocolVersion": "viewer.review/3",
  "kind": "archive",
  "projectId": "00000000-0000-4000-8000-000000000001",
  "reviewStreamId": "00000000-0000-4000-8000-000000000101",
  "archiveId": "00000000-0000-4000-8000-000000000601",
  "createdAtMs": 2,
  "beforeRef": {
    "snapshotId": "00000000-0000-4000-8000-000000000501",
    "blake3": "5050505050505050505050505050505050505050505050505050505050505050"
  },
  "resultSnapshotId": "00000000-0000-4000-8000-000000000502",
  "groups": [
    {
      "usageBasis": null,
      "targets": [
        {
          "feedbackId": "00000000-0000-4000-8000-000000000401",
          "textRevisionId": "00000000-0000-4000-8000-000000000402",
          "targetId": "00000000-0000-4000-8000-000000000411",
          "targetRevisionId": "00000000-0000-4000-8000-000000000421"
        }
      ]
    }
  ],
  "removed": [
    {
      "feedbackId": "00000000-0000-4000-8000-000000000401",
      "textRevisionId": "00000000-0000-4000-8000-000000000402",
      "targetId": "00000000-0000-4000-8000-000000000411",
      "targetRevisionId": "00000000-0000-4000-8000-000000000421"
    }
  ],
  "retained": []
}
